tag,name,keyword,accessibility,summary
SymbolZone,シンボルゾーン,,,現在は閉鎖中です。
Special,企画展示ゾーン,,,詳細：3月18日（金）から、特別展「きみとロボット ニンゲンッテ、ナンダ？」を開催します。多数のロボットを見たり触れたりインタラクティブな仕掛けを体験したりしながら、幅広い層に楽しんでいただけます。
MuitiplePurpose,多目的ルーム,,,詳細：昼食スペースとして利用できるように開放している日があります。利用可否は、スタッフにお尋ねください。
GuestRoom,来客ブース,,,詳細：今日の実験を行っている場所です
Lobby,ロビー,,,詳細：4名掛けの椅子があります。歩き回って疲れた時や一息つきたい時にお使いください。
Shop,ミュージアムショップ,,,詳細：実験キットや文房具などのオリジナルグッズのほか、科学に関するグッズや書籍がそろいます。館内で芽生えた興味をさまざまなかたちで持ち帰ることができます。営業時間は10時から17時です。
Entrance,入口,,,詳細：入り口から外にでてすぐのところにチケットブースがあります
Entrance_Staff,職員用入口。防災センター,,,
Route_Main,交差点,,,